White Halter Bralet In Hand Crochet. This is the hot-selling bralets with 100% Cotton and it is with chest pad. It is suitable for summer wearing ,just enjoy your summer holiday! 	Crop Top	1
Random Geometrical Print Halter Bikini Set. Who's ready to be queen of the pool this summer in this fierce geometrical patterned triangle bikini set! Featuring a contrasting black trim and self-tie at neck and back, this cute little number is a must have this season. Team up with some killer sunglasses and metallic sliders to radiate summer goddess.	Swimwear	2
Plunging Neck Crisscross Back Cami Playsuit. The cutest number has arrived to seriously shake up your entire wardrobe. Made from a lightweight fabric, this playsuit features thin spaghetti straps that crossover at the back and a plunging neckline. This stunner deserves to be seen! Strut your stuff and team it up with statement jewelled earrings and a nude lip for a kickass look!	Playsuits	3
Blue Cold Shoulder 3/4 Length Sleeve T-shirt with Strappy Detail. This soft tee's worth freaking out over. This t-shirt features a round neckline and backline, cold shoulders, and curved hem, slouchy silhouette, and strappy detailing with cutouts at shoulders. Pair it with anything from shorts to skinnies.	Tees	4
Navy V-neck Wrap Front Cami Top. In this summer, you need to have one sleeveless top. This wrap front top is suitable for you. It is designed with v-neck, sleeveless and wrap front. Pair it with your leggings.	Camis & Tank Tops	5
Bohemian Print Long Sleeve Chiffon Kimono. It will be very perfect look to wear this bohemian print long sleeve chiffon kimono and a white knit bra, a blue denim shorts. And if you want to go to the beach, the kimono will be you frist choice to match the hot bikini.	Kimono	6
Sexy V-neck Open Back Playsuit with Cut Out Details. Just add this playsuit into your wardrobe and you will get a complete look with this playsuit. It is adorned with v-neck, sleeveless, side cut out and hidden zip back. You can pair it with sandals for the day then slip into suede heels for the evening!	Playsuits	3
White Sexy V-neck Hollow Out Lace Insert Camis. This gorgeous vest in white is one for those hot sunny days. Featuring sexy V-neck, hollow out, lace details and sleeveless. We're teaming with high waist denim shorts and sliders.	Camis & Tank Tops	5
Semi Sheer Sleeveless Open Back Elastic Waist Playsuit with Lace Insert. In summer, you should buy at least one piece this sexy playsuit. Don't miss this white sleeveless playsuit. It is designed with sleeveless, open back, elastic waist at back and lace details. Finish you fashion look with high heels.	Playsuits	3
Lace-up Hollow Out Elastic Waist Long Sleeves Playsuit. Bring attention to this playsuit. It is sexy and ensure all eyes will be on you when you wear this playsuit. It is adorned with hollow out, lace-up, big keyhole at back, long sleeves and elastic waist. Perfect with your sandals or high heels.	Playsuits	3
Casual Black Halter Design Lace-up Plunge Backless Playsuit . This black plunge romper is both an edgy and super sexy piece that is a cut above the rest. It features a plunge neckline with lace-up details and halter design. Aside from that, it is the perfect outfit to music festivals, which are happening throughout the season.	Playsuits	3
Stripe Pattern Patch Design Long Sleeve Casual T-shirt. This t-shirt made from comfy fabric, comes in a variety of colours design and the stripe pattern and patch details are a style winner. Just throw on with jeans for a casual style look!	Tees	4
Black Sexy Bodycon Long Sleeves Bodysuit . What a sexy bodysuit and ensure you will catch all eyes. Featuring bodycon fit and long sleeves. You can pair it with denim shorts.	Bodysuits	7
Grey Sexy Bodycon Long Sleeves Bodysuit . What a sexy bodysuit and ensure you will catch all eyes. Featuring bodycon fit and long sleeves. You can pair it with denim shorts.	Bodysuits	7
Sexy Deep V-neck Lace-up Front Casual T-shirts in Fuchsia. Look at this casual top, team it with a distressed jeans and a pair of sneakers will be nice for street look this season. Features at deep V neck, long sleeves and lightweight fabric, lace-up front design with make you unique than others. Thus, you will be very sexy to catch everyone's eyes. 	Tees	4
Black Artificial Fox Gilet Outerwear. It's so splendid with its artificial fox detailing that it can provide with the warmth and style you need. It it in loose-fit for the extra comfy feeling. It's made of artificial fur so you can show it off to the crowd guilt-free. 	COATS & JACKETS	8
Sexy Bodycon See-through Deep V Neck Lace-up Front Blouse in Black. This fashion sexy top is a must-have piece this season. Features deep V neck and crossed front design that gives it a sexy style, edgy look. Wear it with jeans would be perfect for go to party night! 	Tees	4
Sexy Crossed Front Design Crop Top in White. Look at this sexy crop top, team it with a jeans and a pair of heels will be nice for street look this season. Features at V neck, long sleeves and soft fabric, cross front design. Just take it for yourself. Your won't regreat.	Crop Top	1
Red Causal Round Neck Cold Shoulder Long Sleeves T-shirts. The casual sexy blouse top is a must-have piece this autumn. Features round neck and cold shoulder design that gives it a lady style, edgy look. Wear it with jeans would be perfect for date out! 	Tees	4
White Casual Round Neck Cold Shoulder Top. This casual soft top worth freaking out over. This top features a round neckline and cold shoulders, slouchy silhouette, and strappy detailing with cut outs at shoulders. Team it up with anything from shorts to skinnies will be perfect. 	Tees	4
Grey Sexy Round Neck Raglan Sleeves Hollow Design Top. This casual lightweight top is the must-have piece this season. Features round neck, you can wear it as one shoulder,raglan long sleeves, hollow design and plain color. Team it up with jeans and heels would be perfect.	Tees	4
Sexy Sweet V-neck Lace Trims Bodysuit in Black. Modern femme bodysuit, available exclusively at Yoins. V neck silhouette with a deep cut front  + stretchy cotton featuring sheer lace panels at front. Gives denim cutoffs a sweet touch. Just take it.	Bodysuits	7
V Neck Lace Up Front Loose T-shirt in Black . Add this casual T-shirts into your wish list. It is adorned with plunge v-neck, long sleeves, lace-up front details and plain color. Pair it with jeans and high heels for street out would be great this season. 	Tees	4
Camel Raelyn Stick on Backless Lace-up Seamless Strapless Under Uplift Bra. Stay supported wearing your fave backless dress with this stick on bra! Featuring a lace uplift centre you can adjust the bra to give you as much or as little lift as you like! Guaranteed to give you a sexy seamless shape!	Bras & Bra Sets	9
 Black Raelyn Stick on Backless Lace-up Seamless Strapless Under Uplift Bra. Stay supported wearing your fave backless dress with this stick on bra! Featuring a lace uplift centre you can adjust the bra to give you as much or as little lift as you like! Guaranteed to give you a sexy seamless shape!	Bras & Bra Sets	9
White Sweet Open Front Cross Strappy Design Crop Top. Strappy-front crop top in a soft rib-knit made just by Yoins. Short sleeves, slim-fit top features a open front with strap detailing, seamed hem and random floral print with little circle hollow.   	Crop Top	1
Black Sexy See-through Lace Bodycon Bodysuit. Turn the rock show into bodysuit show. This number is designed with v-neck, sleeveless, hollow out, lace details and with no falsies. Looks killer paired with heels. 	Sexy Lingerie	10
Halter Neck Lace-up Details Bikini Top & Bottom Set in Green. Stand out on the beach this summer with these gorgeous bikini set! In a stretchy material, Bikini features a lace-up halter neck, ladder straps details front and trangle cotton cup. bikini bottom tying with gold beads details. Team with a sun hat to complete your look. 	Swimwear	2
Navy Sexy Strapless Random Floral Print Choker Playsuit. Sleeveless floral choker romper from our Yoins collection. In a vintage-look floral print made of strapless design. Perfect with high heels.	Playsuits	3
Basic Round Neck Letter Print Tee in Grey. Seriously slouchy round-neck tee with T cut long + loose for easy layering over everything. Made from a softly fabric, short sleeves and with letter print detailing, adding vintage character to the garment, over time.	Tees	4
Army Green Chiffon Double Layer Lace Hem Camis. Classic cami in a chiffon fabrication, by Yoins. This sleeveless modern scoop-neck cami in an easy swing silhouette. Topped with skinny straps and thin straps that lead to a square back.	Camis & Tank Tops	5
Blue & White V-neck Random Floral Print Bikini Set. Glint + glimmer the beach day away in this triangle bikini set by Yoins. Triangle top with padded cups and hook closures at back. Bottoms featuring a  low-rise cut with thin strap sides. this bikini set is perfect for your next summer outing.	Swimwear	2
Halter Backless Random Floral Print Cutout Flounced Playsuit . You'll want to add this playsuit on your wish list. It is designed with plunge v-neck, sleeveless, backless and flounced hem. Perfect with sandals or boots in summer. 	Playsuits	3
Red Sexy Lace-up Backless Design Swimwear . Be a hot sexy beauty with the help of the sexy sleeveless swimwear. You could pair this swimsuit with a stunning cover up or a kimono and get that beach babe look. 	Swimwear	2
White Sexy V-neck Backless Swimwear . Why lay low in your swimwear when you could be the talk of the tropics? We know you have it in you. A sexy style, this bikini set with backless and v neck will make you standout from the crowd.	Swimwear	2
Dark Blue Random Floral Print V-neck Cami with Zipper Design . We are currently obsessing over this camis. It adorned with floral print, sleeveless and zipper design. Style it with coat and mini skirts will be perfect. 	Camis & Tank Tops	5
Spring Off-The-Shouder Stripes Romper. Fantastically femme off-the-shoulder stripes romper by Yoins. In a Lightweight cotton feel fabric with a fitted bodice + defined waist. Topped with a straight off-the-shoulder neckline + tie up sleeves. High waisted bottoms with pleated detailing. 	Playsuits	3
Sweet Off The Shoulder Playsuit in Beige. Better-than-basic romper from Yoins. Relaxed-fit construction with a elasticized band & waistline + ruffled off the shoulder neck. Finished with a relaxed-fit shorts bottom. Paired with the gold cross choker to completed your chic look.	Playsuits	3
Green Sexy Camouflage Pattern V-neck Lace-up Front T-shirt. Basic and sexy, this casual top is perfect for go out. With camouflage pattern and short sleeve, this top features lace-up front details and V neck design that gives it a street style, edgy look. Wear it with jeans would be great! 	Tees	4
Black Off Shoulder Lace Lingerie Set . This off shoulder lace lingeries set is super sexy and feminine! Featuring a mesh patterned lace fabric, elastic lace body details, pretty panel. Show off the bralette top under a sheer shirt! 	Sexy Lingerie	10
Delicate Crochet Hollow Overlay Design Top in White. Bury your toes in the sand with this bohemian-inspired beach-ready top. In a soft + breezy crinkled weave with a relaxed fit and v-neck. Featuring elbow-length sleeves and delicate crochet hollow overlay design. Finished with slit & irregular hem with tassel details. 	Swimwear	2
Casual Rose Embroidered Details T-shirts in White. Sky's the limit in this casual tees. Oh-so soft stretch-knit in a slim-fit construction. Topped with a banded crew-neck, embroidered floral at side + fitted short sleeves. Perfect all on its own or paired up for layering.	Tees	4
Round Neck Cutout Design Random Floral Print Playsuit in Navy. This sweet round neck print playsuit is pretty, elegant and perfect for dressing up or down! Featuring round neckline with buttom at back, elastic waistline, sleeveless and cutout design at front & back. Style it with black wedge heels and bronzed makeup! 	Playsuits	3
Light Blue Fashion Lace Up Sleeveless Swimwear Bikini Set  . Why lay low in your swimwear when you could be the talk of the tropics? We know you have it in you. A v neck style, this bikini set with lace up design will make you standout from the crowd. 	Swimwear	2
Gold Sexy Gold Thread Embroidery Hollow Out Lace Crop Top  . Wear it from day to night. It can keep you in good mood. Featuring sleeveless, halter, hollow out, and lace crochet details. Just put it on with high waist mini skirt or shorts to get a perfect look.	Crop Top	1
Red Design Chest Cut Out Camis. We are currently obsessing over this camis. It adorned with cut out. Style it with skorts and mini skirts will be perfect.	Camis & Tank Tops	5
Sweet Random Floral Print Frills Playsuit. We are so in love with the cut on this goreous playsuit on trend off shoulder overlay design with cute loose sleeves and frill side shorts. This easy fitting, elasticated waist playsuit can be worn with or without the sleeves.	Playsuits	3
Black Sexy Cut Out Top & Slit Design Trousers Two Piece Outfits. Flawlessly designed, the sexy co-ord will instantly update your work wardrobe. Team with our chic sandals to finish. 	Two Piece Outfits	11
Cold Shoulder Irregular Hem T-shirts in Burgundy . Give your look cozy-cool texture with this slouchy v-neck tee by Yoins. Oversized fit with short sleeves, cold shoulder + irregular hem. Whether you're lounging at home or pairing with denim to explore with your besties.	Tees	4
Square Neck Knot at Back Cami Top in Orange. Simple is best! This sexy cami top is a great basic that features a regular fit, square neckline, sleeveless, thin adjustabke staps and knot deal back. Style it with basically anything! We recommend white high waisted denim jeans and flats. 	Crop Top	1
Navy Deep V-Neck High-waist Random Floral Print Playsuit With Shoulder Straps. Make you hot, hot, hot with this special mini playsuit. It is sure you will love it thanks to the deep v-neck design, and sleeveless. Team it up with sneakers. 	Playsuits	3
Random Floral Print Cami Top in Pink  . How stunning is our cami top? Perfect for those lunches with your girls! Featuring a round neckline with an all over stunning floral pattern throughout the top with the hemline featuring a scoop design with the back extenuating longer than the front.	Camis & Tank Tops	5
High Neck Cami Top in Grey. Feel like making a statement with your outfit? Look no further with this cami top, featuring a high neckline, fitted design with ribbed detailing and raw hem. Pair it with skinny jeans for an effortless chic effect. 	Camis & Tank Tops	5
Navy Random Floral Print V-neck Cami with Zipper Design . We are currently obsessing over this camis. It adorned with floral print, sleeveless and zipper design. Style it with coat and mini skirts will be perfect. 	Camis & Tank Tops	5
V-neck Random Leaf Print Cami Top in White. Who doesn't love a stylish singlet top? This leaf print cami top is a perfect casual top featuring a singlet style with V neckline. Style it with white shorts and a fedora hat for a fresh look. 	Camis & Tank Tops	5
Rose Stripe Pattern Backless Swimwear . This bodycon bikini swimwear set is with backless, sleeveless and bodycon fit. Perfect with sandals when you go to the beach. 	Swimwear	2
Yellow Stripe Pattern Adjustable Straps Swimwear . This bodycon bikini swimwear set is with backless, sleeveless and bodycon fit. Tt has adjustable spaghetti strap. Perfect with sandals when you go to the beach.	Swimwear	2
Pink Sexy Cold Shoulder Self-tie Design Playsuit . Bring attention to this mini playsuit. It is adorned with cold shoulder and self-tie design. Pair with sandals will be great.	Playsuits	3
White Chiffon Crochet Hollow Cami Top. The crochet hollow design cami top is fashion forward! Featuring a V- neckline, pleated hem detailing and crochet hollow design. Style it with denim jeans and heels for a chic look!	Camis & Tank Tops	5
Black Deep V-neck Sleeveless Backless Design Swimwear . Be a hot sexy beauty with the help of the sexy sleeveless swimwear. You could pair this swimsuit with a stunning cover up or a kimono and get that beach babe look. 	Swimwear	2
Red Scoop Neck Criss-cross Design Sports Top. Feel like making a statement with your outfit? Look no further with this sports vest, featuring a scoop neckline and criss-cross straps back and sleeveless design. Pair it with a sports shorts for the gym effect. 	Camis & Tank Tops	5
Navy Halter Lace-up Design Bikini Set . Bask in the sun with retro-cool vibes with this sexy bikini set. With its halter and lace-up design, pair with a sunhat and sandals when you go to the beach.	Swimwear	2
Pink Semi Sheer Sleeveless Open Back Elastic Waist Playsuit with Lace Insert. In summer, you should buy at least one piece this sexy playsuit. Don't miss this sleeveless playsuit. It is designed with sleeveless, open back, elastic waist at back and lace insert. Finish you fashion look with high heels.	Playsuits	3
Black Sexy Backless Swimwear. Be a hot sexy beauty with the help of the sexy sleeveless swimwear. You could pair this swimsuit with a stunning cover up or a kimono and get that beach babe look.	Swimwear	2
Baby Pink Random Floral Print Cold Shoulder Wrap Playsuit. You need this super cute floral playsuit in your life! This baby pink playsuit features an all over floral print in a flattering wrap style. With thin straps and a short bardot sleeve this pink playsuit is a holiday essential - just add sandals!	Playsuits	3
Random Floral Print Off Shoulder Slit Blouse . We are currently obsessing over this blouse. It adorned with floral print, off shoulder and slit design. Style it with mini skirts will be perfect. 	Blouses	12
Black V-neck Cami with White Geometrical Pattern. We are currently obsessing over this cami. It adorned with geometrical print, sleeveless and v-neckline. Style it with skorts and mini skirts will be perfect. 	Camis & Tank Tops	5
Random Floral Print Tank Top . We are currently obsessing over this top. It adorned with floral print, sleeveless. Style it with leggings will be perfect. 	Camis & Tank Tops	5
Sexy Lace Crop Top & Slit Skirt Two Piece Outfits. This is two-piece style. Including lace crop and slit skirt. Perfect with heels or sandals when you go out. 	Two Piece Outfits	11
V-neck Random Geometrical Print Cami Top. Who doesn't love a stylish singlet top? This print cami top is a perfect casual top featuring a singlet style with V neckline. Style it with white shorts and a fedora hat for a fresh look. 	Camis & Tank Tops	5
White V-neck Random Floral Print Cami Top. Who doesn't love a stylish singlet top? This floral print cami top is a perfect casual top featuring a singlet style with V neckline. Style it with white shorts and a fedora hat for a fresh look. 	Camis & Tank Tops	5
White Slit Design at Back Random Leaf Print Sleeveless Tank Top. Who doesn't love a stylish singlet top? The leaf print top is a perfect casual top featuring a sexy style with split back detailing at the back, high neckline. Style it with white shorts and a fedora hat for a fresh look.	Camis & Tank Tops	5
Sheer Lace Kimonos in Black. See-through from any angle and you're the sexiest goddess of the pool party. Short kimono sleeves, front open with drawstring waist irregular hem. Airy and lightweight made. This kimono makes you beautiful and confident than before.	Kimono	6
Braided Rope Strappy Design Bikini Set in Sap Green. We're so ready to bring out the sun with this sexy strappy bikini top & bottoms. Classic string bikini with ties at back with soft, cinched cups and braided rope details. Matching strappy design bottoms. Moderate coverage; lined.	Swimwear	2
Burgundy Sexy Cut Out Swimwear . This bodycon swimwear set is with cut out, sleeveless and bodycon fit. Perfect with sandals when you go to the beach.	Swimwear	2
Sexy Random Floral Print Cut Out Swimwear . This bodycon swimwear set is with cut out, sleeveless and bodycon fit. Perfect with sandals when you go to the beach.	Swimwear	2
Black Stripe Halter Sleeveless Playsuit. Here is the fashion playsuit for you. Featuring halter design, stripe pattern and lace up design. Just wear it with high heels and enjoy your times.	Playsuits	3
Pink Floral Crepe Off Shoulder Crop Top & Shorts. Features an elastic off shoulder top with short sleeves.Has a boxy silhouette with an elastic hemline while drawstrings along the top. Looks amazing with the matching floral shorts, layered delicate necklace and clog heels!Everything full of summer feels.	Crop Top	1
Knot at Front Two-piece Bikinis Set in Apricot Pink. You will never want to leave the poolside or sandy shore in this bikini set! The top features a front knot, basic triangle style. The high-rise bottoms have a high cut. Bring out the towels, summer drinks and of course the sun for some blissful summer days.	Swimwear	2
Knot at Front Two-piece Bikinis Set in White. You will never want to leave the poolside or sandy shore in this bikini set! The top features a front knot, basic triangle style. The high-rise bottoms have a high cut. Bring out the towels, summer drinks and of course the sun for some blissful summer days.	Swimwear	2
White Cross Front Top . Here is the fashion top for you. Featuring sleeveless and cross front. Wear this day and night is ok. Perfect with black leggings or casual shorts.	Camis & Tank Tops	5
Blue Random Floral Print HalterStraps Wireless Bikini Set . Do you feel a tribal style in this bikini set. Here is the one for you! It is adorned with halter design, floral print, wireless and straps details. Perfect with sandals or sunglasses when you go to the beach. 	Swimwear	2
V-neck Overlay Dot Drint Cami Top in White. Who doesn't love a stylish singlet top? This dot print cami top is a perfect casual top featuring a singlet style with V neckline. Style it with white shorts and a fedora hat for a fresh look. 	Camis & Tank Tops	5
V-neck Random Geometrical Cami Top in White. Who doesn't love a stylish singlet top? This floral print cami top is a perfect casual top featuring a singlet style with V neckline. Style it with white shorts and a fedora hat for a fresh look. 	Camis & Tank Tops	5
Cactus Print Tank Top in Black. Whether you're running Saturday errands or off on a sunset adventure, this tank top is sure to boost your mood! It adorned with sleeveless, cactus print and crew neckline. Style it with skorts and mini skirts will be perfect. 	Camis & Tank Tops	5
Navy Random Calico Print Strapless Playsuit. This strapless playsuit is pretty, elegant and perfect for dressing up or down! Featuring the strapless trend, high rise bottoms and invisible zipper at the center back. Style it with black wedge heels and bronzed makeup! 	Playsuits	3
Pink Bodycon Low Cut V-neck Bikini Set. You will never want to leave the poolside or sandy shore in this bikini with its stunning classic design! The top features a back gold clasp, basic triangle style with padding and adjustable straps. The low-rise bottoms have a high cut. Bring out the towels, summer drinks and of course the sun for some blissful summer days.	Swimwear	2
V-neck Open Back Cami Playsuit . Bring attention to this mini playsuit. It is adorned with open back and v-neck. Pair with high heels will be great. 	Playsuits	3
Black Feather Printing T-shirt With Cold Shoulder. Here is the fashion t-shirt for you. Featuring cold shoulder and feather printing. Wear this day and night is ok. Perfect with black leggings or casual shorts. 	Tees	4
Apricot Feather Printing T-shirt With Cold Shoulder. Here is the fashion t-shirt for you. Featuring cold shoulder and feather printing. Wear this day and night is ok. Perfect with black leggings or casual shorts. 	Tees	4
Burgundy Feather Printing T-shirt With Cold Shoulder. Here is the fashion t-shirt for you. Featuring cold shoulder and feather printing. Wear this day and night is ok. Perfect with black leggings or casual shorts. 	Tees	4
Black Sexy Deep V Neck Swimwear With Padded Chest . Be a hot sexy beauty with the help of the sexy off the shoulder swimwear. You could pair this swimsuit with a stunning cover up or a kimono and get that beach babe look. 	Swimwear	2
Red Scoop Neck Cold Shoulder Tie-up at Back Tee. The Scoop Neck Cold Shoulder Tie-up at Back Tee is a great choice! Featuring a scoop neckline, relax styled t- shirt with tie-up back, frill at side detailing and cold shoulder short sleeves. For a relaxed look, style it with tights and some flats. 	Tees	4
White Scoop Neck Cold Shoulder Tie-up at Back Tee. The Scoop Neck Cold Shoulder Tie-up at Back Tee is a great choice! Featuring a scoop neckline, relax styled t- shirt with tie-up back, frill at side detailing and cold shoulder short sleeves. For a relaxed look, style it with tights and some flats. 	Tees	4
Navy Scoop Neck Cold Shoulder Tie-up at Back Tee. The Scoop Neck Cold Shoulder Tie-up at Back Tee is a great choice! Featuring a scoop neckline, relax styled t- shirt with tie-up back, frill at side detailing and cold shoulder short sleeves. For a relaxed look, style it with tights and some flats. 	Tees	4
Rose Scoop Neck Cold Shoulder Tie-up at Back Tee. The Scoop Neck Cold Shoulder Tie-up at Back Tee is a great choice! Featuring a scoop neckline, relax styled t- shirt with tie-up back, frill at side detailing and cold shoulder short sleeves. For a relaxed look, style it with tights and some flats. 	Tees	4
Orange Scoop Neck Cold Shoulder Tie-up at Back Tee. The Scoop Neck Cold Shoulder Tie-up at Back Tee is a great choice! Featuring a scoop neckline, relax styled t- shirt with tie-up back, frill at side detailing and cold shoulder short sleeves. For a relaxed look, style it with tights and some flats. 	Tees	4
