Purple Long Sleeves Lace Insert See-through T-shirt. Sale the latest collection of women's tops with high quality. The t-shirt is adorned with see-through lace details and long sleeves. Hottest style to make you attractive every day.	Tees	4
Burgundy Slit Design Plain One Shoulder Long Sleeves Tee With Curve Hem. Add this casual tee into your wish list. It is adorned with one shoulder design, long sleeves, slit design and curve hem Pair it with jeans for street out would be great this season.	Tees	4
Black Lace Insert Plain Scoop Neck Sleeveless Tank Top. Add this tank top into your closet. An easygoing sleeveless top with lace insert front. We love pair it with jeans. It is best choice to go out with friend during weekend. 	Camis & Tank Tops	5
Army Green Contrast Printed Cold Shoulder Long Sleeves Curved Hem Casual T-shirt. The printed T-shirt is in low profile but with depth that you deserved to have one! Featuring an allover random contrast printed pattern, a round neckline, cold shoulder, cami straps, long sleeves ,and a curved hem. Pair it with skinny pants is ok.	Tees	4
Green Cut Out Lace Insert Cold Shoulder Long Sleeves Top. Here is the fashion and sexy top for you. Featuring cut out, lace insert and cold shoulder. Wear this day and night is ok. Perfect with black leggings or casual shorts.	Tees	4
Black Color Block Side Pockets Stripe Long Sleeves Round Neck T-shirts. Add this t-shirt into your closet. An easygoing long sleeves top with color block stripe long sleeves, curve hem and side pockets design. We love pair it with jeans. It is best choice to go out with friend during weekend. 	Tees	4
Grey Contrast Printed Lace Insert Long Sleeves Curved Hem Casual T-shirt. The printed T-shirt is in low profile but with depth that you deserved to have one! Featuring an allover random contrast printed pattern, a round neckline, lace insert, long sleeves ,and a curved hem. Pair it with skinny pants is ok.	Tees	4
Navy Color Block Random Stripe Cold Shoulder Long Sleeves Turtleneck Tee. Featuring a cold shoulder design, color block stripe details and turtleneck, this flattering tee is set to become a firm favourite in your autumn wardrobe. Wear it for day with jeans or take it into evening with your trusty block heels. 	Tees	4
Plus Size Black Cut Out Lace Detail Mini Dress. A fashion plus size mini dress feature with long sleeves, lace detail, round neck, and cut out design.	DRESSES	20
Grey Tiered Design Off The Shoulder Long Sleeves Top. You seriously do not want to miss out on this special top! It features off the shoulder, long sleeves and tiered design. Just pair it with jeans will be perfect.	Tees	4
Random Floral Print Spaghetti Strap V-neck Camis. Random Floral Print Spaghetti Strap V-neck Camis. Sale the latest collection of women's tops with high quality. Hottest style to make you attractive every day. Free shipping worldwide.	Camis & Tank Tops	5
Green Zip Design Lapel Collar Long Sleeves Coat. This zip design coat will definitely make you look more fashion! This coat features a lapel collar, long sleeves and zip design. Wear this open front coat with a casual top and skinny jeans.	COATS & JACKETS	8
Black Zip Design Lapel Collar Long Sleeves Coat. This zip design coat will definitely make you look more fashion! This coat features a lapel collar, long sleeves and zip design. Wear this open front coat with a casual top and skinny jeans.	COATS & JACKETS	8
Black V-neck Sequins Embellished Sleeves Top. This sequins embellished top is one for your big event! Featuring a v-neck and long sleeves. Style yours with your skinny jeans to finish the fashion look.	Tees	4
Color Block Color Block Cut Out High Neck Long Sleeves Knitted Top. The color block makes it a good eye-catching piece. This top features high neck, long sleeves and cut out design. This knitted top would make an ideal pair with skinny jeans.	Tees	4
Color Block Cut Out High Neck Slit Sleeves Knitted Top. The color block makes it a good eye-catching piece. This top features high neck, slit sleeves and cut out design. This knitted top would make an ideal pair with skinny jeans.	Tees	4
Plus Size Red Laser Cut Out Scallop Hem Shirt Dress. A fashion plus size shirt dress feature with cut out design, laser design, scallop hem, button design and self-tie design. Perfect with high heels!	DRESSES	20
Plus Size Red Ruffle Off Shoulder Formal Maxi Dress. A fashion plus size maxi cocktail party dress feature with long sleeves, off the shoulder design, cut out, tiered design, ruffle design,and zipper design.	DRESSES	20
Plus Size Purple Ruffle Off Shoulder Formal Maxi Dress. A fashion plus size maxi cocktail party dress feature with long sleeves, off the shoulder design, cut out, tiered design, ruffle design,and zipper design.	DRESSES	20
Plus Size Purple Split Sleeves Velvet Midi Dress. A fashion plus size midi dress feature with split sleeves, cut out back, long sleeves, mesh, and polka dot . Perfect with the high heels.	DRESSES	20
Plus Size White Bell Sleeve Ruffle Hem Sweater. A plus size white sweater featuring a v-neck, long sleeves, bell sleeves, ruffle hem, button design.	TOPS	21
Plus Size Green Bell Sleeve Ruffle Hem Sweater. A plus size sweater featuring a v-neck, long sleeves, bell sleeves, ruffle hem, button design.	TOPS	21
Plus Size Black Bell Sleeve Ruffle Hem Sweater. A plus size black sweater featuring a v-neck, long sleeves, bell sleeves, ruffle hem, button design.	TOPS	21
Leopard Print Mock Neck Long Sleeved Crop Top in Khaki. Don't stop the crop babe! A stylish leopard crop top in a knit bodice. Detailed with a mock neckline and long sleeves. Has a form hugging silhouette. Looks perfect with sleek bottoms, a layered necklace and clog heels!	Crop Top	1
Plus Size Black Contrast Camo Raglan Sleeve T-shirt. A plus size t-shirts featuring a round neck, long sleeves, contrast camo raglan sleeves.	TOPS	21
Plus Size Army Green Contrast Camo Raglan Sleeve T-shirt. A plus size t-shirts featuring a round neck, long sleeves, contrast camo raglan sleeves.	TOPS	21
Plus Size Black Off Shoulder Tiered Midi Dress. A fashion plus size midi dress feature with off the shoulder design, tiered design, ruffle design, and short sleeves, midi.	DRESSES	20
Plus Size Black Lace Crochet Blouse. A plus size blouses featuring a v-neck, lace crochet, long sleeves.	TOPS	21
Grey Hooded Design Plain Pullover Long Sleeves Lace Up Front Hoodie. Put on this sexy hoodie with high waist skinny jeans or short to get a complete look. Featuring  lace up details, hooded design, deep v neck and long sleeves. You're sure to catch people' eyes. Just take it. 	Sweatshirts	15
Black Pullover Pouch Pocket Long Sleeves Hoodie. Put on this hoodie with high waist skinny jeans to get a complete look. Featuring drawstring, pouch pocket and long sleeves. You're sure to catch people' eyes. Just take it. 	Sweatshirts	15
Grey Letter Print Pullover Long Sleeves Crop Sweatshirt. Put on this casual top with high waist skinny jeans to get a complete look. Featuring letter print, pullover and long sleeves. You're sure to catch people' eyes. Just take it. 	Sweatshirts	15
Burgundy Cut Out Plain Cold Shoulder Design Long Bell Sleeves Blouse. Feel cool and comfy in this blouse, with cold shoulder, long bell sleeves and cut out details. Wear it for a trip or on the autumn street would be great! 	Blouses	12
Green Self-tie Design Plain Crew Neck Long Lantern Sleeves Crop Tee. Can't wait to having this fashion crop top. Featuring self-tie design,crew neck and long lantern sleeves. Pairing sport pants and gym shoes can be perfect	Tees	4
Grey Lace Insert Plain Pullover Long Sleeves Hooded Design Hoodie. Add this top into your closet. An easygoing long sleeves top with hooded design, lace insert and pullover. We love pair it with jeans. It is best choice to go out with friend during weekend. 	Sweatshirts	15
Plus Size Purple Button Design V-neck Blouse. A plus size blouses featuring a v-neck, long sleeves, button design, and handkerchief hem.	TOPS	21
Black Self-tie Design V-neck Crossed Front Irregular Hem Tee. Can't wait to having this fashion top. Featuring self-tie design,crossed front, v neck and irregular hem. Pairing bodycon pants can be perfect. 	Tees	4
Leopard Print Bell Sleeve Open Back Tie-up Crop Top. Bell-ieve it babe! A chic and stylish crop top featuring an open back with tie-up  straps. Also features long bell sleeves. Leopard printed in a woven bodice. Style with denim bottoms and clog heels! 	Crop Top	1
Leopard Cut Out Perkins Lace Up Front Collar Tank Tops. sssssss	Camis & Tank Tops	5
Color Block Plain Crew Neck Long Elastic Sleeves Tee. Put on this simple casual top with high waist skinny jeans to get a complete look. Featuring  crew neck,long elastic sleeves and color block. You're sure to catch people' eyes. Just take it. 	Tees	4
Basic Red Plain Turtleneck Long Sleeves Bodycon Fit Tee. Add this basic tee into your wish list. It is adorned with turtleneck, long sleeves and bodycon fit Pair it with jeans for street out would be great this season.	Tees	4
Black Side Pockets Fashion Bodycon Leather Leggings. Look at fashion leather leggings on yoins.cm, a clothes online store you can buy all kind of latest women clothes, included sexy active tops, new arrival tops and active tracksuits.	Leggings	24
Black Slit Design Plain One Shoulder Long Sleeves Tee With Curve Hem. Add this casual tee into your wish list. It is adorned with one shoulder design, long sleeves, slit design and curve hem Pair it with jeans for street out would be great this season.	Tees	4
Navy Side Cut Out Random Floral Print Round Neck Long Sleeves Top. This side cut out design is a wardrobe essential. This top features a round neckline, long sleeves and floral print. Team with skinny jeans to get that off-duty model look.	Tees	4
Color Block Fuffly Drawstring Hoodie. Hoodie weather ootd! An essential hoodie in a color block fluffy bodice. Features a hooded back with drawstrings. Also has a boxy silhouette. Looks perfect with denim bottoms and sneakers! 	Sweatshirts	15
Camo Color Block Long Sleeved Fluffy Hoodie. A minimalist sweater top featuring a hooded back with front drawstrings. Long sleeved with a relaxed boxy silhouette. In a fluffy knit bodice camo color block all throughout. 	Sweatshirts	15
Black V-neck Crochet Lace Trim Pinstripe Cami Top. A summer chic cami top featuring an V neck with chochet lace trims. In a woven bodice. Style with denim bottoms and clog heels! 	Camis & Tank Tops	5
Burgundy Lace-up Front Crew Neck Self-tie Design Two Piece Outfit With Slip Pockets. Can't wait to having this sport two-pieces outfits. Featuring self-tie design, crew neck, slip pockets and lace up details. Pairing gym shoes can be perfect. 	Two Piece Outfits	11
Plus Size White Lace Padded Bra with Wire. This basic bra featuring lace, built-in underwire, wire, adjustable shoulder straps and hook-and-eye closure.	INTIMATES	23
Plus Size Black Lace Trim Wireless Padded Bra. This basic bra featuring scalloped lace trim, built-in underwire, wireless, adjustable shoulder straps.	INTIMATES	23
Navy Crew Neck Long Sleeves Loose T-shirt. Put on this casual top with high waist skinny jeans to get a complete look. Featuring crew neck and long sleeves. You're sure to catch people' eyes. Just take it. 	Tees	4
Plus Size Leopard Sleeveless Midi Dress. A fashion plus size dress feature with sleeveless, leopard design, midi, bodycon hem and round neck. Perfect with the high heels!	DRESSES	20
Plus Size Leopard Midi Dress. A fashion plus size dress feature with long sleeves, leopard design, midi, bodycon hem and round neck.	DRESSES	20
Black Random Stripe Cold Shoulder Long Sleeves Turtleneck Tee. Featuring a cold shoulder design, stripe details and turtleneck, this flattering blouse is set to become a firm favourite in your autumn wardrobe. Wear it for day with jeans or take it into evening with your trusty block heels. 	Tees	4
Plus Size Green Self-tie Ruffle Trim Bell Sleeve Blouse. A plus size blouses featuring a round neck, long sleeves, bell sleeves, ruffle trim, self-tie design. 	TOPS	21
Plus Size Black Letter Rainbow Striped Side Pants. A plus size black pants featuring a drawstring waist, letter print, rainbow striped side design.	BOTTOMS	22
Blue Animal Pattern Deep V Neck Single Breasted Design Bat Sleeves Blouses. Add this blouse into your closet. An easygoing bat sleeves top with single breasted design, animal pattern and deep v neck. We love pair it with jeans. It is best choice to go out with friend during weekend. 	Blouses	12
Burgundy Pleated Design Grid Off Shoulder Lantern Sleeves Blouses. We're delighted to update our off shoulder design with this fashion blouse. Featuring a grid pattern, pleated details and lantern sleeves. Pair it with our skinny jeans or leggings are perfect!	Blouses	12
Zebra Stripe Choker Neck Keyhole Cutout Chest Long Bell Sleeved Blouse. A fashionable blouse in a lightweight crepe bodice with a zebra stripe print. Features long bell sleeves with a front keyhole cutout design. Has a boxy silhouette. Style with denim bottoms and clog heels! 	Blouses	12
Pink Crossed Front Design Round Neck Long Sleeves Knitted Top. Here is the fashion crossed front design top for you. Featuring round neck and long sleeves. Perfect with skinny jeans to match a street style.	Tees	4
Color Block Round Neck Long Sleeves T-shirt. Look so casual with the color block top, skinny jeans and a pair of sneakers. This T-shirt is designed with round neck and long sleeves. With this T-shirt, You will be very fashion to catch everyone's eyes.	Tees	4
Green Cut Out Front Design Perkins Collar Irregular Hem Long Sleeves Tee. Put on this simple casual top with high waist skinny jeans or short to get a complete look. Featuring perkins collar, cut out details, irregular hem and crossed front. You're sure to catch people' eyes. Just take it. 	Tees	4
Rose Color Cut Out Front Design Perkins Collar Irregular Hem Long Sleeves Tee. Put on this simple casual top with high waist skinny jeans or short to get a complete look. Featuring perkins collar, cut out details, irregular hem and crossed front. You're sure to catch people' eyes. Just take it. 	Tees	4
Plus Size Color Block Plaid Self-Tie Shirt Mini Dress. A fashion plus size dress feature with color block	DRESSES	20
Burgundy Crew Neck Long Sleeves Loose T-shirt. Put on this casual top with high waist skinny jeans to get a complete look. Featuring crew neck and long sleeves. You're sure to catch people' eyes. Just take it. 	Tees	4
Plus Size Grey Lace Insert Blouse. A plus size blouses featuring a round neck, long sleeves, lace insert, and curved hem.	TOPS	21
Plus Size Green Floral Print Mini Dress. A fashion plus size dress feature with long sleeves, floral print, curved hem, mini, and round neck.	DRESSES	20
Plus Size Grey Pocket Design Coat. A fashion plus size coat feature with long sleeves, pocket design, zipper design. Perfect with pants and high heels.	COATS & JACKETS	8
Leopard Cut Out Front Cold Shoulder Flounced Details Flared Sleeves Blouse. We're delighted to update our cold-shoulder design with this casual blouse. Featuring a cut out details, leopard pattern, flounced details and flared sleeves. Pair it with our skinny jeans or leggings are perfect!	Blouses	12
Color Block Hooded Design Zip Front Fastening Long Sleeves Coat With Slip Pockets. Get suited and booted this season with this coat. In color block fabric, this coat features slip pockets, zip front fastening, hooded design and long sleeves. Make sure to wear this coat with the matching white t-shirt and jeans!	COATS & JACKETS	8
Black Lettuce-edge V-neck Long Sleeves Top. This special lettuce-edge top is a wardrobe essential. Featuring a v neckline and long sleeves, team with your jeans to get that off-duty model look.	Blouses	12
Polka Dot Spliced Deconstructed Deep V Neck Blouse With Collar . Make heads turn in this spliced deconstructed blouse. It is adorned with polka dot pattern, deep v neck and 3/4 length sleeves. Pair it with jeans. With collar, this special blouse makes you perfect.	Blouses	12
Plus Size Burgundy Button Design Zipper Coat. A plus size coat featuring a notch collar, long sleeves, button design, zipper front, and high-low hem.	COATS & JACKETS	8
Burgundy Multi-Way Push-Up Underwire Lace Bra Set. A beautiful lace overlayer adorns this Multi-Way Push-Up Bra Sets, featuring underwire, removable shoulder strap and back hook-and-eye closures.Persect to show your figure!	Bras & Bra Sets	9
Black Multi-Way Push-Up Underwire Lace Bra Set. A beautiful lace overlayer adorns this Multi-Way Push-Up Bra Sets, featuring underwire, removable shoulder strap and back hook-and-eye closures.Persect to show your figure!	Bras & Bra Sets	9
Blue Bowknot Detail Sheer Lace Bra Set. The lace bra set was made from high quality very stretchy soft lace. Very comfortable and feeling free wearing it. Fits nice with some oversized tunic, top or like underwear, underneath overisized tops, dresses.	Bras & Bra Sets	9
Black Bowknot Detail Sheer Lace Bra Set. The lace bra set was made from high quality very stretchy soft lace. Very comfortable and feeling free wearing it. Fits nice with some oversized tunic, top or like underwear, underneath overisized tops, dresses.	Bras & Bra Sets	9
White Leopard Lapel Collar Button Up Blouse . Put on this leopard blouse with high waist skinny jeans to get a complete look. Featuring lapel collar, v-neck and long sleeves. You're sure to catch people' eyes. Just take it.	Blouses	12
Black & White Geometrical Crew Neck Long Sleeves Crop Sweatshirt. Add this casual T-shirts into your wish list. It is adorned with round neck, long sleeves and geometrical pattern. Pair it with jeans for street out would be great this season.	Sweatshirts	15
Leopard Print Mock Neck Long Sleeved Crop Top in Purple. Don't stop the crop babe! A stylish leopard crop top in a knit bodice. Detailed with a mock neckline and long sleeves. Has a form hugging silhouette. Looks perfect with sleek bottoms, a layered necklace and clog heels!	Crop Top	1
Leopard Print Puff Sleeved Hi-low Hem Maxi Tunic Top in White. Create an instant lift for your style with this uniquely leopard print tunic top for a streamlined finish to your looks. 	Blouses	12
Leopard Print Puff Sleeved Hi-low Hem Maxi Tunic Top. Create an instant lift for your style with this uniquely leopard print tunic top for a streamlined finish to your looks. 	Blouses	12
Black V-neck Long Sleeved With Sequins Embellished Top. This sequins embellished top is one for your big event! Featuring a v-neck and long sleeves. Style yours with your skinny jeans to finish the fashion look.	Tees	4
Plus Size Purple Hoodies High-Low Hem Dress. A fashion plus size dress feature with long sleeves, high-low hem design, hoodies design, lace insert, and lace-up design.	DRESSES	20
Red Backless Design Leopard Perkins Collar Long Sleeves Blouse. Can't wait to having this fashion top. Featuring perkins collar, leopard pattern and backless design. Pairing bodycon pants can be perfect. 	Blouses	12
Beige Backless Design Leopard Perkins Collar Long Sleeves Blouse. Can't wait to having this fashion top. Featuring perkins collar, leopard pattern and backless design. Pairing bodycon pants can be perfect. 	Blouses	12
Stripe Pattern Round Neck Long Sleeved Crop Tees. A minimalist top featuring a round neck and long sleeved with a relaxed crop boxy silhouette. In a stretch knit bodice stripe pattern all throughout.	Tees	4
Plus Size Black Lace Maxi Dress. A fashion plus size dress feature with lace, 3/4 length sleeves, wrap design, v-neck, and maxi. Perfect with high heels to party	DRESSES	20
Plus Size Red Lace Maxi Dress. A fashion plus size dress feature with lace, 3/4 length sleeves, wrap design, v-neck, and maxi. Perfect with high heels to party	DRESSES	20
Black& White Side Pockets Leopard Classic Collar Long Sleeves Single Breasted Shirt. Put on this simple fashion top with high waist skinny jeans or short to get a complete look. Featuring  leopard pattern, single breasted design, side pockets and classic collar. You're sure to catch people' eyes. Just take it. 	Blouses	12
Random Tribal Print V-neck Lace-up Front Blouse. Keep it light and chic! A must have blouse featuring V neck and lace-up front. Has a textured knit bodice with a boxy fit and tribal print. Style with denim bottoms and clog heels! 	Blouses	12
Plus Size Blue Sequin Mini Dress. A fashion plus size dress feature with long sleeves, sequin design, bodycon fit, bodycon hem, and mini. Perfect with high heels to the party!	DRESSES	20
Plus Size Black Cape Mini Dress. A fashion plus size dress feature with cape design, mini, bodycon hem, and v-neck.	DRESSES	20
Green Hooded Design Plain Long Sleeves Hoodie With Slip Pockets. Add this casual hoodie into your wish list. It is adorned with hood design, long sleeves and slip pockets. Pair it with jeans for street out would be great this season.	Sweatshirts	15
Pink Lace Trim Two Piece Pajama Set. Style meets elegance with this Lace Trim Two Piece Velvet Pajama Set! It is included Lace trim slit design nightdres and lace insert self-tie sash robe to cozy up the look and show your charming figure.	Sleepwear	19
Black Scoop Neck High Low Hem Night Dress. This basic night dress is one for your sleep designed! Featuring scoop neck, long sleeves, pocket design and high low hem. 	Sleepwear	19
Black Gloss Sequins Round Neck Long Sleeved Cutout Top. An essential top that features long sleeves with cutout design. In a stretch knit bodice with a gloss sequins print. Has a comfortable form hugging fit. Looks perfect with denim bottoms and sneakers! 	Tees	4
Color Block Stripe Details Crew Neck Long Sleeves Sweatshirt. Put on this simple casual top with high waist skinny jeans to get a complete look. Featuring  crew neck, long sleeves and stripe details. You're sure to catch people' eyes. Just take it. 	Sweatshirts	15
Black Cut Out Details Crossed Collar Long Sleeves Cold Shoulder Tee. Can't wait to having this fashion top. Featuring cold shoulder, crossed collar and cut out details. Pairing delicate necklace and bodycon pants can be perfect. 	Tees	4
Grey Box Pleat Bell Sleeves Curved Hem Blouse. Put on this grey blouse with high waist skinny jeans to get a complete look. Featuring box pleat, bell sleeves and curved hem. You're sure to catch people' eyes. Just take it.	Blouses	12
Burgundy Stripe Cold Shoulder Long Sleeves Turtleneck Tee. Featuring a cold shoulder design, stripe details and turtleneck, this flattering blouse is set to become a firm favourite in your autumn wardrobe. Wear it for day with jeans or take it into evening with your trusty block heels. 	Tees	4
Plus Size Black Pocket Design Coat. A fashion plus size coat feature with long sleeves, pocket design, zipper design. Perfect with pants and high heels.	COATS & JACKETS	8
Plus Size Pink Button Design Blouse. A plus size blouses featuring a round neck, long sleeves, adjustable sleeve length, button design.	TOPS	21
Burgundy Wireless Lace Trim Bra. Add this bra into your closet. It is designed with lace trim, adjustable shoulder wireless and back hook+ eye closure design. Perfect to show your charming figure.	Bras & Bra Sets	9
Plus Size Rose Floral Print Self-Tie Design Midi Dress. A fashion plus size midi dress feature with rose floral print, self-tie design, v-neck, 3/4 length sleeves, and warp design.	DRESSES	20
Black Round Neck Cold Shoulder Lantern Sleeves Tee. Put on this casual top with high waist skinny jeans to get a complete look. Featuring round neck tee, cold shoulder and lantern sleeves. You're sure to catch people' eyes. Just take it.	Tees	4
Plus Size Butterfly Print Zipper Blouse. A plus size blouses featuring a v-neck, long sleeves, zipper front, butterfly print.	TOPS	21
Plus Size Blue Lace Maxi Dress. A fashion plus size dress feature with lace, 3/4 length sleeves, wrap design, v-neck, and maxi. Perfect with high heels to party	DRESSES	20
Plus Size Red Sequin Mini Dress. A fashion plus size dress feature with long sleeves, sequin design, bodycon fit, bodycon hem, and mini. Perfect with high heels to the party!	DRESSES	20
Plus Size Black Sequin Mini Dress. A fashion plus size dress feature with long sleeves, sequin design, bodycon fit, bodycon hem, and mini. Perfect with high heels to the party!	DRESSES	20
Plus Size Silver Sequin Blouse. A plus size blouses featuring a round neck, half sleeves, sequins embellished.	TOPS	21
Lapel Collar Short Sleeves Casual Top. Nothing says cosy like a fashion top. The modern lapel collar and short sleeves make you look more casual. Throw on with our trousers for a complete look!	Tees	4
Plus Size Grey Lace Detail Tank Top. A plus size grey tank top featuring a round neck, sleeveless, and lace detail.	TOPS	21
 Fashion Navy Off Shoulder Floral Print Blouse. Look at fashion floral blouses on yoins.cm, a clothes online store you can buy all kind of latest women clothes, included sexy dress, new arrival tops and sport bottoms.	Blouses	12
Casual Style Tie-up Design High-Waisted Midi Skirt. Your hunt for the perfect skirts ends at Yoins.com. Affordable Skirts online store for every occasion. Shop now for the latest styles of Skirts.Bring attention to this midi skirt. It features with plain color, tie-up design, high-waisted and midi length. Team it up with heels would be perfect to show your figure.	Skirt	13
Lace-up Design Round Neck Cami. This cami is one for your big event! Featuring a round neck and lace-up design at back. Style yours with hot pants or jeans to finish the look.	Camis & Tank Tops	5
Navy Random Floral Print Off the Shoulder Irregular Hem Blouse. Here is the fashion blouse for you. Featuring off shoulder, floral print and irregular hem. Wear this day and night is ok. Perfect with shorts. 	Blouses	12
Red Christmas Elk Graphic Socks. This pair of socks features a cute Christmas elk graphics, it very in line with the Christmas atmosphere, and the socks are also very soft and warm.	Accessories	0
