Navy Hollow Design Round Neck Half Sleeves Tee. Make head turn on this navy casual tee. It features round neck, pleated design, half sleeves, floral hollow design.	Tees	4
Plus Size White Adjustable Round Neck Lace Insert Blouse. This white blouse is a must-have item in your wardrobe. This long sleeves blouse features button detailing for adjustable sleeve length.	TOPS	21
Plus Size Gold Backless Design Camis. The camis featured with golden color and satin material. It is perfect for daily wear, vacation, dates, sports and makes you look special. 	TOPS	21
Plus Size Brown Sequins Embellished Leopard Splice Tee. This top had the WOW factor! This splice tee is regular fit, sequin embellished and round neck. Style it with skinny jeans.	TOPS	21
Plus Size Blue Stripe Floral Print V-neck Tee. Beautiful print style with v-neck design, simple, chic and delightful top for summer. Blue stripe and floral print design makes you so special in the crowd. You can pair it with jeans or leggings. Suitable for leisure, date, party, beach, office.	TOPS	21
Plus Size Yellow Lace Insert Long Sleeves Burn-out Top. A wardrobe without a piece of lace insert top is a big missing. This is designed with cut out and burn-out design. The fabric is great, style it with jeans is perfect.	TOPS	21
Plus Size White Lace Insert Round Neck Blouse. Fill your 2019 wardrobe with blouse, including this plus size lace blouse. Featuring elastic sleeves and lace insert.	TOPS	21
Plus Size Black Hollow Design Lace Round Neck Dress. This lace tight dress is perfect for wearing a party. This dress also combines the design of round neck, lace details, hollow design and hide zipper. It looks very sexy.	DRESSES	20
Black Cut Out Tie-up At Cuffs Round Neck Tee. Make head turn on this casual tee. This tee is the best choice for you in spring or summer. Featuring round neck, cut out design, tie-up at cuffs.	Tees	4
Black Cut Out V-neck 3/4 Length Sleeves Fashion Tee. Make head turn on this fashion tee. Featuring v-neck, cut out, tie-up at cuffs. It is the best choice for you in spring and summer.	Tees	4
Grey Cut Out Round Neck Half Sleeves Tee. This casual tee is designed by cut out, round neck, tie-up at cuffs and pleated design. It has breathable and comfortable features. Moreover, it is suitable for spring or summer to wear.	Tees	4
Burgundy Randm Floral Print V-neck Short Sleeves Tee. Beautiful print style with v-neck design, simple, chic and delightful top for summer, you can pair it with jeans or leggings. This tee is breathable and great to wear all day. Suitable for any occasion,such as party, cocktail, beach, office, date.	Tees	4
Multi Color Stripe Deep V Neck Bell Sleeves Blouse. The multi color stripes of this blouse are very beautiful and fashionable. And it features stitching hem and bell sleeves. It can be paired with jeans or trousers in casual.	Blouses	12
Black Backless Design Halter Criss-cross Bodysuit. This halter bodysuit will be comfortable to wear in the summer. It features halter design, criss-cross design and backless design. It can perfectly show the body line. And it can be paired with jeans or shorts.	Bodysuits	7
Grey Twist Star Pattern One Shoulder Tee. This twist design tee is an essential piece for this seasons. It has a random star pattern and one shoulder. Style with high skinny jeans or shorts will be perfect.	Tees	4
Navy V-neck Short Sleeves Tee. This modern top is easy to style and it is fitting on any body shape. And perfect for layering with coat or cardigans. 	Tees	4
Grey Pleated Design Ruched Drape Sagging Bat Sleeves Tee. This ruched tee is combines bat sleeves, pleated design and drape sagging. It can be paired with trousers or jeans.	Tees	4
Black Cut Out Sexy Bodysuit With Adjustable Shoulder Straps. We are so in love with the cut out design on the front. This sexy bodysuit features adjustable shoulder straps and sleeveless. Style it with shorts or skirts.	Bodysuits	7
White Random Floral Print Tube Design Two Piece Outfits. Made of high-quality, soft lightweight fabric. Bare shoulders and crop design can show off your perfect body in summer, suitable for gathering, daily, work, vacation and other occasions.	Two Piece Outfits	11
White Random Floral Print V neck Cami Top. This white random floral print top is our new style, this loose V-neck top can be paired with jeans and high heels.	Camis & Tank Tops	5
Orange Random Floral Print Round Neck Tank Top. Time to turn the temperature up a notch in the tank top! This fashionpiece features random floral print and round neck. Just pair it with jeans and you could get a complete look.	Camis & Tank Tops	5
Snake Print Cut Out Backless Tassel Details Jumpsuit. Work this seriously standout party dress this season. It is adorned with snake print, cut out design and tassel details. We love it with high heels. 	Jumpsuit	16
Snake Print Zip Front High-Waisted Skirt. Your hunt for the perfect skirts ends at Yoins.com. Affordable Skirts online store for every occasion. Shop now for the latest styles of Skirts.Bring attention to this snake skirt. It features with snake pattern, zip front design, high-waisted and mini length. Team it up with boots would be perfect to show your figure.	Skirt	13
Army Green V Neck Spaghetti Strap Jumpsuit with Belt. Discover the latest girl jumpsuit with many styles and colours at YOINS. It has spaghetti strap, v neck, side pockets and belt design. 	Jumpsuit	16
Burgundy Lace Insert Off The Shoulder Smocking Blouse. Creating an edgy look with this fashion smocking blouse. This number is adorned with off the shoulder and lace insert design. We love it with jeans and high heels.	Blouses	12
Blue Twist Crossed Collar Short Sleeves Tee. This blue short sleeves tee has a crossed collar detail and a short sleeve twist design that makes the clothes more fashion and lively.	Tees	4
Green Lace Off The Shoulder Long Sleeves Blouse. This blouse is a fashion one and comfortable in summer, it features a off the shoulder and lace detailed. Pair it with jeans would be great.	Blouses	12
Burgundy Ruffle Trim V-neck Blouse. This blouse is one that one need to add to your wardrobe girl. Featuring ruffle trim and v neck, style this blouse with jeans for a look we are crushing on.	Blouses	12
Black Cut Out V-neck Half Sleeves Blouse. This blouse had the WOW factor! This blouse is designed with v-neck design, cut out and half sleeves. Style it with ripped jeans will be great.	Blouses	12
Burgundy Tiered Design Cold Shoulder Fashion Blouse. The tiered design blouse could be the outstanding feature of this blouse you are fond of! You will feel more fashion than ever in this blouse. Style with jeans or skirts will be perfect.	Blouses	12
Black Cut Out Crew Neck Long Sleeves Blouse. This blouse is a casual one and comfortable, it features a crew neck and cut out design. Pair it with your skinny jeans would be great.	Blouses	12
Navy Crossed Front Design Cold Shoulder Blouse. It is not hard to have a fashion look with this blouse. Every girl will love it for its design. Featuring cold shoulder and crossed front design. Team it up with high waist jeans is perfect.	Blouses	12
Black Polka Dot V-neck Ruffle Spaghetti Cami. A vacation cami top featuring polka dot print all throughout. Has an V neckline with spaghetti ruffle straps. Perfect for team with denim jeans.	Camis & Tank Tops	5
Olive Green V-neck Cozy Tee. Seriously soft + light knit tee in a loose fit with a deep-v neckline + long sleeved with adjustable cuffs.	Tees	4
Plus Size Black Lace Wireless Bra . Sexy lace bra, wireless, adjustable straps, elastic bandage, chest part is lace material. Light, comfortable support ideal for B- E cups. Wide adjustable straps reduce shoulder pressure. Wireless, padded cup brings comfort and support.	INTIMATES	23
Plus Size Nude Lace Wireless Bra . Sexy lace bra, wireless, adjustable straps, elastic bandage, chest part is lace material. Light, comfortable support ideal for B- E cups. Wide adjustable straps reduce shoulder pressure. Wireless, padded cup brings comfort and support.	INTIMATES	23
Plus Size Navy Blue Lace Wireless Bra . Sexy lace bra, wireless, adjustable straps, elastic bandage, chest part is lace material. Light, comfortable support ideal for B- E cups. Wide adjustable straps reduce shoulder pressure. Wireless, padded cup brings comfort and support.	INTIMATES	23
Burgundy Cold Shoulder Long Sleeves Knitted Bodysuit. You will be looking so fabulous in this bodysuit! In a knitted fabric, this bodysuit features cold shoulder and long sleeves. Team up with skinny jeans will be perfect!	Bodysuits	7
Black Crossed Front Design One Shoulder Top & Flounced Trousers Co-ord. Creating an edgy look with this fashion co-ord. This number is adorned with one shoulder, crossed front design and flounced hem. We love it with high heels.	Two Piece Outfits	11
Black Tiered Design One Shoulder Bodysuit. A wardrobe without a piece of bodysuit is a big missing. This is designed with one shoulder and tiered design. The fabric is great, style it with jeans is perfect.	Bodysuits	7
Black Cut Out One Shoulder Bodysuit. This bodysuit will definitely make you look more fashion! This bodysuit features one shoulder and cut out design. Wear this bodysuit with jeans will be perfect.	Bodysuits	7
Grey Cut Out Off The Shoulder Long Sleeves Top. This pure color top gives your casual t-shirt a sexy flair. This top features off the shoulder and cut out design on the sleeves. It's perfect with your skinny jeans or cutoff shorts, depending on the weather.	Tees	4
Navy Twist Random Floral Print V-neck Long Sleeves Blouse. This fashion blouse features floral print and twist design which make you special compare with others. Style it with jeans for a perfect outfit.	Blouses	12
Navy Cut Out V-neck Long Sleeves Blouse. Make you look more fashion with this special blouse. It is sure you will love it thanks to the cut out design and v-neck. Team it up with trousers will be perfect.	Blouses	12
Burgundy Self-tie Design V-neck Bodysuits. This bodysuit is the must-have piece in this season. Featuring self-tie design and v-neck. You could pair this bodysuit with jeans and get that fashion look.	Bodysuits	7
Black Backless Design Deep V Neck Sexy Bodysuit. This bodycon is in fashion and sexy style. It is styled with backless design and deep v neck which make you look more sexy. Just pait it with bodycon skirts to get a sexy look.	Bodysuits	7
White V-neck Lace Insert Bodysuits. Everyone needs a basic bodysuit! A must have bodysuit in a soft stretch jersey knit bodice solid all throughout. Detailed with adjustable straps, lace insert V-neck and button snap closures along the bottom. Unlined.	Bodysuits	7
White Random Floral Print Deep V Neck Backless Bikini. If you want a sexy bikini set, if you want to have a wonderful experience on beach or swimming pool, then this one can be considered firstly. Featuring stripe print, sleeveless, high-waisted, backless, you deserve to have one.	Swimwear	2
Black Cut Out Cold Shoulder Tie-up at cuffs Blouse. Getting back to basics never looked so good with this cut out design blouse. Features cold shoulder and bell sleeves. Perfect for going out with skinny jeans!	Blouses	12
Black Tiered Design Cold Shoulder Fashion Blouse. This blouse is one versatile topper you'll want to have. It can show you a casual style because of cold shoulder design and tiered design. So just styled with your jeans.	Blouses	12
Black See Through Design V-neck Long Sleeves Blouse. Thoroughly modern see through blouse from Yoins. It is styled with v neck and long sleeves. Team it up with your skinny jeans for a casual style.	Blouses	12
Burgundy Tiered Design Cold Shoulder Blouse. Who doesn't love a fashion blouse? The cold shoulder blouse is a perfect casual top featuring a stain fabric and tiered design. Style it with shorts and jeans for a fresh look.	Blouses	12
Navy Pleated Design Off The Shoulder Bell Sleeve Blouse. Here is the fashion blouse for you. Featuring off the shoulder and bell sleeves. Perfect with skinny jeans to match a perfect look.	Blouses	12
Black Hollow Design Off The Shoulder Top. Nothing says cosy like a fashion top. The modern hollow design and off the shoulder make you look more chic in this season. Throw on with our denim jeans for a complete look!	Tees	4
White Grid Halter Cut Out Self-tie Design Bikinis. Stand out on the beach this summer with these gorgeous bikini set! This Bikini features a tie up detail, v neck and cut out design. Bikini bottom tying with gold beads details. Team with a sun hat to complete your look. 	Swimwear	2
Navy Tie-up Design Pure Color Long Sleeves Blouse. It is a super breathable and lightweight woman's blouse, clipped design pure color blouse.  Perfect for your daily wear, dates and parties... any occasion is perfect in spring, summer and fall. 	Blouses	12
Black Semi Sheer Stand Collar Shirring Blouse. The blouse featured with mesh design, bell sleeves and stand collar. It is perfect for daily wear, vacation, dates, sports, working, street wear and makes you look special. 	Blouses	12
Black One Shoulder Long Sleeves Tee. This tee had the WOW factor! This tee is loose fit, one shoulder and long sleeves. Style it with skinny jeans to make a street style.	Tees	4
Black Ruffle Trim Long Sleeves Glitter Blouse. We all love glitter fblouse since it is made in glitter fabric. It is detailed with ruffle trim and long sleeves. Perfectly to match with skinny jeans for a fashion look	Blouses	12
Black Sequins Embellished Trim Top. A minimalist and chic sequin hem blouse in a lightweight woven bodice solid all throughout. Features a round neckline and 3/4 sleeves. Has a hi-lo cut with a flowy boxy silhouette. Style with denim bottoms and clog heels! 	Blouses	12
Black Tiered Design Cold Shoulder Blouse. This pure color blouse gives your casual top a chic flair. This blouse features cold shoulder design and tiered design. It's perfect with your skinny jeans or cutoff shorts, depending on the weather.	Blouses	12
Navy Twist V-neck Short Sleeves Blouse. This blouse had the WOW factor! This blouse is loose fit, V-neck design and fashion twist in the front of the blouse. Style it with jeans is perfect.	Blouses	12
Black Beaded Details High-Waisted Wide Leg Pants. Discover women's fashion pants here, with a wide range of collections. Buy latest styles of ladies pants at a cheap price. You will heading straight in the right direction with this wide leg pants. It features with beaded details, wide leg and high-waisted. Team it up with heels  for that complete look. 	Pants	17
Navy Polka Dot Cold Shoulder Lace-up Front Ruffle Sleeve Blouse. Change it up this season! A polka dot blouse in a woven bodice. Features an V neck with lace-up design, shoulder cut outs and ruffle long sleeves. Looks amazing with denim shorts, hoop earrings and booties! 	Blouses	12
Black Cut Out Cold Shoulder Bell Sleeves Fashion Blouse. This blouse is the fashion commercial work clothing. It is adorned with cold shoulder, long bell sleeves and cut out design. Pair it with your skinny jeans will be great.	Blouses	12
Navy Polka Dot Round Neck Long Sleeves Blouse. This blouse features breathable material that makes for such a fashion look! It feature round neck, long sleeves and polka dot. The blouse is perfectly paired with jeans!	Blouses	12
Black Sequin Wide Leg Zip Design Sleeveless Jumpsuit. This fashion jumpsuit features sequin embellished and wide leg design which makes you special compare with other jumpsuit. Style it with a high heels for a perfect look.	Jumpsuit	16
Navy Crochet Lace Embellished High-Waisted Wide Leg Jumpsuits. Jumpsuits For Women With Wholesale Prices Online | Yoins.com 		
You will heading straight in the right direction with this wide leg jumpsuits. It is adorned with V neck, lace insert, crochet lace embellished, see through design, wide leg, stitching design and side pockets. Team it up with heels would be perfect to show your figure.	Jumpsuit	16
Black Crossed Front Design Random Floral Print V-neck Blouse. Basic and sexy, this blouse is perfect for go out. With floral print, this top features crossed front design and V neck design that gives it a fashion style. Wear it with jeans would be great!	Blouses	12
Stripe Slit Design V-neck Long Sleeves Blouse. This beautiful striped blouse caters to your ladylike style, this long-sleeved shirt is crafted from lightweight stretch fabric with a V-neck.	Blouses	12
Black Cut Out Cold Shoulder Blouse. A wardrobe without a piece of blouse is a big missing. This is designed with long sleeves, cold shoulder and cut out. The fabric is great, style it with jeans is perfect.	Blouses	12
Color Block Backless Design Stripe Round Neck Tee. Our color block tee will make a welcome addition to your wardrobe. It is adorned with round neck and backless design. We love it with skinny jeans.	Tees	4
Beige Tie-up Design Grid Round Neck Blouse. You'll be heading straight in the right direction with this grid blouse. Finishing grid pattern and tie-up design, our blouse is perfect when teamed with jeans for a day at the office! 	Blouses	12
Silver Twist Bodycon Glitter Mini Party Skirt. Here is fashion skirt for you. This skirt has bodycon design, glitter and twist design. Discover the latest girl skirt with many styles and colours at YOINS.	Skirt	13
Yellow Lace Inset V-neck Cami. It's time to get cami. Show you this vest is designed with v neck, sleeveless and lace insert on collar. Style it with shorts to keep you look chic.	Camis & Tank Tops	5
Dark Grey Random Floral Print Round Neck Blouse. This soft blouse worth freaking out over. This blouse features a round neck , long sleeves and random floral print. Pair it with skinny jeans would be great.	Blouses	12
Black Ruffle Trim General Collar Lantern Sleeves Blouse. This blouse is the fashion commercial work clothing. It is adorned with long sleeves and ruffle trim. Pair it with your jeans. 	Blouses	12
Navy Halter Design Casual Tank Top. Halter design makes you more sexy and attractive. Sexy blouse for ladies, perfect for work, party, travel and other informal occasions. Pair it with your favorite jeans and a pair of flat sandals.	Camis & Tank Tops	5
Black Tiered Design Off The Shoulder Blouse. With this fashion jblouse, it comes with off the shoulder and tiered design. Team this blouse with your skinny jeans for a fashion look.	Blouses	12
Burgundy Side Pockets Stretch Waistband Jogger Pants. Get great selection of fashion dresses for women online at Yoins.com. Here you can find cute women tops, outerwear, knitwear, sweatshirts and hoodies at low prices.	Pants	17
V-neck Hollow Out Short Sleeves T-shirts in Light Grey. Seriously slouchy V-neck short sleeves tee from Yoins. T cut long + loose for easy layering over everything. Made from a softly textured knit that will unravel slightly after washing to evolve, adding vintage character to the garment, over time.	Tees	4
V-neck Hollow Out Short Sleeves T-shirts in Green. Seriously slouchy V-neck short sleeves tee from Yoins. T cut long + loose for easy layering over everything. Made from a softly textured knit that will unravel slightly after washing to evolve, adding vintage character to the garment, over time.	Tees	4
Sweet Off The Shoulder Plays in Burgundy. Better-than-basic romper from Yoins. Relaxed-fit construction with a elasticized band & waistline + ruffled off the shoulder neck. Finished with a relaxed-fit shorts bottom. Paired with the gold cross choker to completed your chic look.	Playsuits	3
Navy Stripe V-neck Sleeveless Wide Leg Jumpsuit. This is a striped pattern jumpsuit, stretch waistband, backless, sleeveless, adjustable shoulder strap, it is perfect for summer wear.	Jumpsuit	16
Tropical Floral Print Backless Halter Tankini Swimsuit. Sale the latest collection of women's swimsuits with high quality. Hottest style to make you attractive every day. 	Swimwear	2
Blue Random Floral Print Backless Halter Tankini Swimsuit. Sale the latest collection of women's swimsuits with high quality. Hottest style to make you attractive every day. 	Swimwear	2
Random Floral Criss-cross Tie-up Design Sexy Bikinis. Sale the latest collection of women's bikinis with high quality. Hottest style to make you attractive every day. 	Swimwear	2
Random Floral Print Criss-cross Tie-up Design Sexy Bikinis. Sale the latest collection of women's bikinis with high quality. Hottest style to make you attractive every day. 	Swimwear	2
Yellow Random Floral Criss-cross Tie-up Design Sexy Bikinis. Sale the latest collection of women's bikinis with high quality. Hottest style to make you attractive every day. 	Swimwear	2
Yellow Random Floral Print Criss-cross Tie-up Design Sexy Bikinis. Sale the latest collection of women's bikinis with high quality. Hottest style to make you attractive every day. 	Swimwear	2
Navy Calico Off The Shoulder  Double Layer Playsuit. Sale fashionable playsuits online with excellent service.	Playsuits	3
Burgundy Wide Leg Backless Side Pockets Jumpsuit. Work this seriously standout Jumpsuit this season. It is adorned with wide leg, zip back fastening and Belt design. We love it with high heels. 	Jumpsuit	16
Burgundy Ruffle Trim Twist Round Neck Tee. This is a beautiful short sleeve top to team up with all your hot pants! That what we deserve to have one. Featuring round neck, ruffle trim. Add it into you wardrobe in no time. 	Tees	4
Blue Ruffle Trim Twist Round Neck Tee.  This is a beautiful short sleeve top to team up with all your hot pants! That what we deserve to have one. Featuring round neck, ruffle trim. Add it into you wardrobe in no time. 	Tees	4
Grey Lace Details Bowknot See Through Bra with Underwire. Update your lingerie collection with this lace bra, it is designed with underwire, lace details and back hook & eye closure! Very comfortable and feeling free wearing it!	Bras & Bra Sets	9
Black Lace Details Bowknot See Through Bra with Underwire. Update your lingerie collection with this lace bra, it is designed with underwire, lace details and back hook & eye closure! Very comfortable and feeling free wearing it!	Bras & Bra Sets	9
Blue Lace Details Bowknot See Through Bra with Underwire. Update your lingerie collection with this lace bra, it is designed with underwire, lace details and back hook & eye closure! Very comfortable and feeling free wearing it!	Bras & Bra Sets	9
Pale Mauve Lace Details Bowknot See Through Bra with Underwire. Update your lingerie collection with this lace bra, it is designed with underwire, lace details and back hook & eye closure! Very comfortable and feeling free wearing it!	Bras & Bra Sets	9
Black Halter Sleeveless Lace Design Sleepwear. Black Halter Sleeveless Lace Design Sleepwear	Sleepwear	19
Black Lace Trim Back Hook Design Bra with Underwire. Update your lingerie collection with this lace bra, it is designed with underwire, lace trim and back hook! Very comfortable and feeling free wearing it!	Bras & Bra Sets	9
Pink Lace Trim Back Hook Design Bra with Underwire. Update your lingerie collection with this lace bra, it is designed with underwire, lace trim and back hook! Very comfortable and feeling free wearing it!	Bras & Bra Sets	9
Nude Lace Trim Back Hook Design Bra with Underwire. Update your lingerie collection with this lace bra, it is designed with underwire, lace trim and back hook! Very comfortable and feeling free wearing it!	Bras & Bra Sets	9
Coffee Lace Back Hook Design Bra with Underwire. Update your lingerie collection with this lace bra, it is designed with underwire, lace trim and back hook! Very comfortable and feeling free wearing it!	Bras & Bra Sets	9
Black Deep V-neck Lace Detail Sleepwear. The sleepwear have deep v neck design and lace detail. Looks very sexy. It's comfortable to dress when you sleep.	Sleepwear	19
Black Floral Embroidered Wireless Bra with Padded. Update your lingerie collection with this embroidered bra, it is designed with padded, wireless and front hook & eye closure! Very comfortable and feeling free wearing it!	Bras & Bra Sets	9
Burgundy Floral Embroidered Wireless Bra with Padded. Update your lingerie collection with this embroidered bra, it is designed with padded, wireless and front hook & eye closure! Very comfortable and feeling free wearing it!	Bras & Bra Sets	9
Black  Backless Adjustable Shoulder Straps Plain Sleeveless Loose Waist Jumpsuit. Work this seriously standout sexy jumpsuit this season. It is adorned with black color and backless design. We love it with high heels.	Jumpsuit	16
Green Spaghetti Strap Polka Dot Tank Top. This vest is designed by spaghetti strap, v neck, polka dot pattern. It can be paired by jeans or skirt in the summer. It is suitable for summer beach. Moreover, it also can be worn to highlight the figure.	Camis & Tank Tops	5
Burgundy Spaghetti Strap Polka Dot Tank Top. This vest is designed by spaghetti strap, v neck, polka dot pattern. It can be paired by jeans or skirt in the summer. It is suitable for summer beach. Moreover, it also can be worn to highlight the figure.	Camis & Tank Tops	5
Nude Spaghetti Strap Polka Dot Tank Top. This vest is designed by spaghetti strap, v neck, polka dot pattern. It can be paired by jeans or skirt in the summer. It is suitable for summer beach. Moreover, it also can be worn to highlight the figure.	Camis & Tank Tops	5
Black Backless Design Lace Edge Tank Top. This tank top is featuring v-neck, lace edge design, self-tie design. It is suitable for summer beach, vocations. Pair with your favorite tight skirt or skinny jeans for a casual everyday look.	Camis & Tank Tops	5
White Backless Design Lace Edge Tank Top. This tank top is featuring v-neck, lace edge design, self-tie design. It is suitable for summer beach, vocations. Pair with your favorite tight skirt or skinny jeans for a casual everyday look.	Camis & Tank Tops	5
