Plus Size Stripe Spaghetti Strap V-neck Sleeveless Jumpsuit. For those casual days where it feels like you've got nothing to wear, this jumpsuit is perfect for casual wear! This jumpsuit features v neck with spaghetti strap design, stripe and cut out details. Simple design makes great fashion look and ultra comfortable fit	BOTTOMS	22
Plus Size Multi Stripe Zip Design Sleeveless Bodysuit. You seriously do not want to miss out on this bodysuit! It features multi stripe and zip design. It can helps modify your figure and you will look slimmer. Just wear this bodysuit and show your glamour.	TOPS	21
Orange Backless Design Pleated Deep V Neck Jumpsuit. Fashion jumpsuit and good quality. Suitable for many occasions, going out or party. It features deep v neck, backless design, sleeveless and pleated design.	Jumpsuit	16
Orange Tie-Dye Stripe Paisley Print Off The Shoulder Blouse. Bring attention to this tie-dye blouse for you. Featuring off the shoulder, paisley print and stripe design. You can't image how charming when you wear this beautiful blouse!	Blouses	12
Apricot Scarf Printed Knot Design Halter Camis. This camis is so comfortable and flattering, soft fabric for a comfortable feminine touch, can be easily dress up. It features scarf printed and halter design that makes you so special in the crowd. 	Camis & Tank Tops	5
Plus Size Black Cold Shoulder Dress With Lining. This plus size dress has cold shoulder, lace insert, double layer. Team it up with your high heels for going out.	DRESSES	20
Plus Size Black Lace Spaghetti Strap Smocking Waist Dress. This black dress looks plain but the lace insert design looks more fashionable and delicate. Sleeveless dress match with knit outwear would makes you look more tender. 	DRESSES	20
Yellow Wide Leg Floral Print Long Pants. Show your charm and make you special. Floral print, wide leg and long length are the features of this pants. You deserve it. 	Pants	17
Plus Size Black Zip Design Floral Print Halter Sleeveless Dress. This black dress with floral print design and halter design would make you look in good shape and suit for many occasions such as vacation, cocktail, party.	DRESSES	20
Plus Size Burgundy Random Floral Print Drawstring Top. This burgundy top has split sleeves design and drawstring shoulder strap design, it is great with jeans, denim pants, high waist shorts, leggings and trousers.	TOPS	21
Plus Size Orange Self-tie Design Embroidered Deep V Neck Dress. Deep v neck embroidered sleeveless dress has a self-tie design. Wearing a dress with especial and national embroidered patterns which will bring you a romantic vacation.	DRESSES	20
Color Block Self-tie Design Color Blocking Blouse. Color block and self-tie design is the features of this blouse, wear it with jeans, skirt and short pants would make you look fashion.	Blouses	12
Pink Slit Design Wide Leg Pants. Pink Slit Design Wide Leg Pants	Pants	17
Yellow Lace Insert Random Floral Print Round Neck Top. Yellow casual top have a lace insert and round neck which can show your sexy body perfectly. Wearing it for a casual party, you will get compliments the entire day.  	Camis & Tank Tops	5
White Knit Square Neck Short Sleeves Tee. Add this casual tank top into your wish list. It is features knit and square neck design. Pair it with jeans would be great this season.	Tees	4
Color Block Lace Details Round Neck Short Sleeves Tee. This tee design with color block and lace detail. Simple, chic and delightful tee for summer, you can pair it with jeans or leggings. This tee is breathable and great to wear all day. 	Tees	4
Yellow V-neck Half Sleeves Blouse. The blouse is so comfortable and flattering. Soft fabric for a comfortable feminine touch, can be easily dress up. Simple, chic and delightful top for summer. It is breathable and great to wear all day.	Blouses	12
Yellow V-neck Backless Tank Top. This top is simple but it also has special feature. It features v-neck and sleeveless. If you are looking for a tank top, please try this beautiful style.	Camis & Tank Tops	5
Apricot Lapel Collar Pockets Design Sleeveless Blouse. This apricotis blouse is an essential piece for this seasons. Featuring lapel collar and sleeveless design. Pair with your favorite skinny jeans for a casual everyday look.	Blouses	12
Plus Size Pink Tropical Print V-neck Dress. Here is a fashion style patch dress for you. Basic in tropical print short sleeves, v-neck design. Tropical print is the feature of this dress.	DRESSES	20
Purple Cold Shoulder Short Sleeves Tee. The t-shirt designed with bateau collar and cold shoulder. High quality material brings you a comfortable experience. It is perfect for daily wear, vacation, dates, working, street wear and makes you look special. 	Tees	4
Black Cold Shoulder Cut Out Short Sleeves Tee. Work this black tee this season. It is adorned with cold shoulder and cut out design. We love it with jeans and high heels.	Tees	4
Plus Size Navy Satin Deep V Neck Ruffle Trim Dress. You seriously do not want to miss out on this plus size dress which have self-tie design that give you curves in the right place. The dress suitable for wearing for a normal occasion. It's comfortable and decent.	DRESSES	20
Plus Size Yellow V-neck Self-tie Design Sleeveless Dress. This plus size dress would be a perfect companion in the party or work, dress have self-tie design and v neck design makes you more sexy and attractive. It's comfortable and decent.	DRESSES	20
Black Button Design Lapel Collar Short Sleeves Playsuit. Great design, high quality and super soft. It features lapel collar, tie-up at cuffs, button design and short sleeves. Suitable to show your charm. 	Playsuits	3
Purple Double Layer Floral Print Off The Shoulder Playsuit. Add this fashion playsuit into your wish list. It is adorned with double layer, off the shoulder, floral print and shirring. Pair it with high heel for street out would be great this season. 	Playsuits	3
Green Printed V-neck Bat Sleeves Blouse. We are currently obsessing over this blouse. It adorned with print and v-neck. Style it with mini skirts will be perfect. 	Blouses	12
White Mesh Pom Pom Hem Skirt With Lining. The skirt featuring an mesh pattern, with linning design and contrasting pom pom hem. We love it with high heels!	Skirt	13
White Self-tie Design Leaf Print Sleeveless Jumpsuit. Holiday and casual style. Self-tie design, spaghetti strap, v-neck and slit design are its features. You can have a try. 	Jumpsuit	16
Orange Pleated Design Random Calico Cold Shoulder Blouse. This orange blouse with random calico print is colorful and make you look adorable, wear with short pants and high heels would look in good shape.	Blouses	12
Orange Knot Design Cold Shoulder Tee. That what we deserve to have one. Featuring cold shoulder and knot design. Add it into you wardrobe in no time.	Tees	4
Rust Pocket Design Square Neck Sleeveless Jumpsuit. This soft jumpsuit worth freaking out over. This jumpsuit features a square neck, sleeveless, pocket design. Wear a white tee inside the jumpsuit and pair it with high heels would be great. 	Jumpsuit	16
PLus Size Black Wrap Design Floral Print Dress. This black dress with floral print design and cap sleeves design would make you look in good shape and suit for many occasions such as vacation, cocktail, party.	DRESSES	20
Neon Yellow V Neck Short Sleeves Playsuit With Wrap Design. The neon playsuit with wrap design is very comfortable to dress in summer . Sale fashion playsuit online with excellent service. Find more beautiful playsuit in YOINS.	Playsuits	3
White Ruffle Trim Cap Sleeves Jumpsuit. This soft jumpsuit worth freaking out over. This jumpsuit features a v-neck, cap sleeves, zipper design. Wear a white tee inside the jumpsuit and pair it with high heels would be great. 	Jumpsuit	16
Blue Stripe Floral Print Halter Sleeveless Blouse. Still looking for a suitable blouse for your vacation? Then this floral print blouse is here for you. The halter and stripe design on it makes you more beautiful. Team it up with a pair of sandals would make you look perfect.	Blouses	12
Blue Tie Dye Backless Design Short Sleeves Tee. If you want something flirty to catch some attention, this multi color tiedye tee. Making this alluring is its backless design. Wear it down with jeans, or up with skirt for a fanciful look.	Tees	4
Plus Size Yellow Crochet Lace Bell Sleeves Drawstring Waist Dress. This yellow dress with crochet lace design and bell sleeves design would make you look in good shape and suit for many occasions such as vacation, cocktail, party.	DRESSES	20
Plus Size Red Crossed Front Design Deep V Neck Dress. Here is a fashion style dress for you. Basic in red color, deep v neck and cross front design. Soft and smooth feeling is the feature of this dress.	DRESSES	20
Red Floral Print Off The Shoulder Ruffle Trim Blouse. Loose waist design can hide hide small belly.  Off  the shoulder design make you more sexy in this summer. Easy to style and it is flattering on any body shape. Pair this blouse with leggings or for a casual yet  trendy look.	Blouses	12
White Lace Round Neck Sleeveless Tank Top. This white casual tank top have a round neck and lace insert design which can wearing it for a casual dating, you will get compliments the entire day.  	Camis & Tank Tops	5
Black Cut Out Random Floral Print Self Tie Halter Cami. Floral print, self-tie halter and cut out design are the features of this cami. Wear it with jeans and get a casual look would make you look great.	Camis & Tank Tops	5
Blue Lace Details Ripped Denim Short. Sale the latest collection of women's shorts with high quality. Hottest style to make you attractive every day.	Shorts	25
Casual Style Half Sleeves Tee. This casual tee have half sleeves which is great with jeans, denim pants, high waist shorts, leggings and trousers. Perfect summer tee for beach, party, date, vacation and special occasions. 	Tees	4
Grey Pleated Design Round Neck Short Sleeves Tee. This basic tee is simple but perfect to highlight your charm. Featuring pleated design and short sleeves. You can wear it with jeans. 	Tees	4
White Backless Design Floral Print Deep V Neck Sleeveless Bikini. It's an eye-catching combo that can be mixed and matched with any of your bikinis for a different beach look daily. Pair this bikini set with a floppy hat and sunnies.	Swimwear	2
Red Backless Design Snake Pattern Deep V Neck Sleeveless Bikini. Holiday and sexy style. Backless design, deep v neck, halter and snake pattern are its features. You can have a try. 	Swimwear	2
Blue Stripe Classic Collar Cut Out Sleeveless Shirt. Get a fashion look with this shirt, it is perfect choice in this season. It is designed with classic collar, sleevesless, button front, stripe and mini length. Finish your fashion look with jeans or skirt. 	Blouses	12
Multi Self-tie Design Stripe Halter Sleeveless Bikini Set. Start your summer weekend right with this deep v-neck lace-up bikini set. You're the best look on the beach.	Swimwear	2
Yellow Crossed Front Design Halter Bikini Set. Why lay low in your swimwear when you could be the talk of the tropics? We know you have it in you. A sexy style, this bikini set with sexy style and halter design will make you standout from the crowd.	Swimwear	2
Pink Self-tie Design Floral Print V-neck Bikini Set. Start your summer weekend right with this v-neck and floral print bikini set. You're the best look on the beach.	Swimwear	2
Pink Adjustable Shoulder Straps Knotted Design Polka Dot Bikini. Love summer and beach. You can take this bikini for your holiday. Knotted design, spaghetti strap and polka dot give you a whole new feeling. 	Swimwear	2
Red Adjustable Shoulder Straps Knotted Design Polka Dot Bikini. Love summer and beach. You can take this bikini for your holiday. Knotted design, spaghetti strap and polka dot give you a whole new feeling. 	Swimwear	2
Orange Adjustable Shoulder Straps Stripe Deep V Neck Bikini. Love summer and beach. You can take this bikini for your holiday. Backless design, spaghetti strap and stripe give you a whole new feeling. 	Swimwear	2
Red Backless Design V-neck Sleeveless Bikini Set. Start your summer weekend right with this v-neck and floral print bikini set. You're the best look on the beach.	Swimwear	2
Yellow Backless Design V-neck Sleeveless Bikini Set. Start your summer weekend right with this deep v-neck and yellow bikini set. You're the best look on the beach.	Swimwear	2
Apricot Smock Design Off The Shoulder Top. Throw-on-and-go style doesn't more fashion than our tee, an eye-catching piece with smock design and off the shoulder design.Pair this awesome piece with your high heels and skinny jeans or shorts for a look everybody will adore. 	Camis & Tank Tops	5
Multi Backless Design Stripe Halter Bikini Set. Start your summer weekend right with this deep v-neck lace-up bikini set. You're the best look on the beach.	Swimwear	2
Blue Stripes Cold Shoulder Short Sleeves Tee. This ombre tee with cold shoulder design is great with jeans, denim pants, high waist shorts, leggings and trousers. Perfect summer tee for beach, party, date, office, vacation and special occasions. 	Tees	4
White Backless Design Scoop Neck Sleeveless Beach Dress. Work this seriously standout mini dress this season, It is adorned with white color, sleeveless and crochet design. We love it with high heels.	Swimwear	2
Plus Size Green Cut Out Tropical Printed Deep V Neck Swimwear. Still looking for a suitable swimwear for your vacation? Then this floral print swimwear is here for you. The deep v neck and leaf print design on it makes you more beautiful. Sexy and fashion style fit for holiday, beach, prom.	SWIMWEAR	2
Plus Size Navy Blue Flounced Hem Polka Dot Deep V-Neck Dress. There is a wonderful dress with polka dot pattern, deep v neck and ruffle sleeves. Specially, it is wrap design. It's attractive to wear it when you are shopping or going vacation. 	DRESSES	20
Plus Size Multi Floral Print Tassel Details High-Waisted Shorts. Hot summer, people always can't help but want to be more cooler, This shorts a good choice for you. Floral print design and tassel design, let everything looked so perfect.	BOTTOMS	22
Tribal Print V-neck Stretch Waistband Blouse. Add this fashion blouse into your wish list. It is adorned with tribal print, deep v neck and half sleeves. Pair it with jeans for street out would be great this season.	Blouses	12
Yellow Leaf Print V Neck Self-tie Design Blouses. Tropical print, bell sleeves and self-tie design is the features of this blouse. Wear it with jeans and get a casual look would make you look great.	Blouses	12
Burgundy Adjustable Shoulder Straps V-neck Sleeveless Cami. We are currently obsessing over this cami. It adorned with invisible zip and inverted fold. Style it with skirts and mini skirts will be perfect.	Camis & Tank Tops	5
Plus Size Random Floral Print V Neck Dress. Here is a fashion style multicolor dress for you. Basic in orange color, half sleeves, deep v-neck design. Bell sleeves is the feature of this dress.	DRESSES	20
Plus Size Black Lace Deep V-neck Half Sleeves Dress. This black dress with lace design and deep v neck would make you look in good shape and suit for many occasions such as vacation, cocktail, party.	DRESSES	20
Army Green V-neck Half Sleeves Tee. This tee would be a perfect companion in the summer. Simple, chic and delightful tee for summer, easy to pair with hot shorts or jeans for casual look. This tee is breathable and great to wear all day.	Tees	4
Blue V-neck Half Sleeves Tee. This tee would be a perfect companion in the summer. Simple, chic and delightful tee for summer, easy to pair with hot shorts or jeans for casual look. This tee is breathable and great to wear all day.	Tees	4
Plus Size Floral Print Halter Backless Sleeveless Swimwear. Still looking for a suitable swimwear for your vacation? Then this floral print swimwear is here for you. The halter and ruched design on it makes you more beautiful. Team it up with cover-up and get that beach babe look.	SWIMWEAR	2
Floral Print Off The Shoulder Drawstring Design Crop Top. Come on, this floral print crop top is an essential piece for this seasons. Have one into your closet. Designed with off the shoulder and drawstring design. It is easy matching, such as with hot shorts.	Crop Top	1
Pink Smocking Design Floral Print Off The Shoulder Blouse. This pink blouse is perfect for going out in summer or vacation. It features smocking design, tie-up at cuffs and floral print. And it can be paired with jeans or shorts.	Blouses	12
Navy Smocking Design Floral Print Off The Shoulder Blouse. This navy blouse is perfect for going out in summer or vacation. It features smocking design, tie-up at cuffs and floral print. And it can be paired with jeans or shorts.	Blouses	12
Plus Size Navy Blue Lace Wireless Padded Bra. This basic bra featuring scalloped lace, built-in underwire, wireless, adjustable shoulder straps and a dual hook-and-eye closure.	INTIMATES	23
Blue Backless Design Deep V Neck Sleeveless One Piece. Love summer and beach. This one piece is special for your holiday.  Deep v neck, hollow design and backless design give you a whole new feeling. 	Swimwear	2
Navy Cold Shoulder Pleated Design Beaded Tee. Look totally dreamy in navy blouse, design with beaded embellished and cold shoulder. Team with tan sandals and tassel bag for a fanciful look. 	Tees	4
Cherry Print High Waist Cute Bikini Set . This cherry print bikini set is in cute style. Showing out your graceful posture with high waist and underwire design. Don't hesitate to dress on it to enjoy the beach time. 	Swimwear	2
Black Random Floral Print Halter Tank Top. A wardrobe without a piece of floral print tank top is a big missing. This is designed with halter design. The fabric is great, style it with jeans or hot pants is perfect.	Camis & Tank Tops	5
Black Lace Embroidered Insert V-neck Self-tie Design Blouse. This blouse is the ultimate essential for this season girl. Featuring a soft fabric, lace insert design and self tie design. Keep it casual and style with jeans.	Blouses	12
Plus Size Blue Crochet Lace Embellished Cami. This blue cami has spaghetti strap and crochet lace embellished design, it is great with jeans, denim pants, high waist shorts, leggings and trousers.	TOPS	21
Plus Size Grid High-Waisted Skirt. Your hunt for the perfect skirts ends at Yoins.com. Affordable Skirts online store for every occasion. Shop now for the latest styles of Skirts.Bring attention to this grid skirt. It features with grid pattern, high-waisted and mini length. Team it up with boots would be perfect to show your figure.	BOTTOMS	22
Plus Size Leaf Print Backless Design Halter Swimwear. A colorful swimwear paired with a sandy beach is perfect for summer. The distinctive self-tie design is the key to be out of the ordinary.	SWIMWEAR	2
Plus Size Black Scoop Neck Backless Swimwear. This swimwear would be a perfect companion in the summer, at the beach or on holiday. It features backless and scoop neck design. Just with it enjoy your holiday time.	SWIMWEAR	2
Plus Size Tropical Print Scoop Neck Backless Swimwear. This swimwear would be a perfect companion in the summer, at the beach or on holiday. It features tropical print and scoop neck design. Just with it enjoy your holiday time.	SWIMWEAR	2
Blue Crossed Front Design Polka Dot V-neck Cami. Spaghetti strap and polka dot is the feature of this cami. It is fashion and casual, which is suitable for many occasions, like vacation or shopping. 	Camis & Tank Tops	5
White Hollow Design Embroidered V-neck Half Sleeves Blouse. That what we deserve to have one. Featuring embroidered and hollow design, v neck and half sleeves. Add this white blouse into you wardrobe in no time. 	Blouses	12
Multi Stripe Lapel Collar Front Button Knot Design Blouse. Bring attention to this multi stripe blouse for you. Featuring lapel collar, knot design and front button. Just style it with sandals and jeans it will be perfect. 	Blouses	12
Plus Size Knotted Design Tribal Print V-neck Dress. Brilliant blooms! A vivid floral motif creates an eye-catching effect on Eva's graceful, feminine Allegra Wrap Dress. 	DRESSES	20
Plus Size Red Lace Trim V-neck Sleeveless Tank Top. This red lace trim top would be a perfect companion in the summer, at the beach or on tropical holiday. 	TOPS	21
Orange Deep V Neck Sleeveless Blouse. Make you sexy and elegant with this blouse. It is sure you will love it thanks to the deep v neck, design sleeveless design and high-low hem design. Pair it with jeans would be great.	Blouses	12
Pink Stripe Cold Shoulder V-neck Knot Design Blouse. Beautiful stripe style with cold shoulder design. Simple, chic and delightful top for summer, you can pair it with jeans. This blouse is breathable and great to wear all day. 	Blouses	12
Lime Criss-cross Design Backless Tank Top. It is the great choice for you if you are looking for a fashion tank top featuring criss-cross design, v-neck and sleeveless. We love it with hot pants or jeans. 	Camis & Tank Tops	5
Khaki Pleated Sleeveless Drawstring Waist Playsuit. Get great selection of fashion playsuit for women online at Yoins.com. Here you can find cute women playsuit, featuring self-tie design and drawstring waist.	Playsuits	3
Navy Mesh Embroidered Round Neck Short Sleeves Blouse. This special design blouse and will steal your heart! Chic and comfy, the mesh embroidered design of sleeves makes you more cooler and romantic in the summer.	Blouses	12
Pink Tie Dye Cut Out Sleeveless Jumpsuit. This soft jumpsuit worth freaking out over. This jumpsuit features a v-neck, sleeveless, self-tie design and tie dye pattern.	Jumpsuit	16
Rose Lace Hem Stand Collar Tank top. We are currently obsessing over this tank top. It adorned with stand collar design and lace hem. Style it with skirts and mini skirts will be perfect.	Camis & Tank Tops	5
Apricot Crochet Lace Embellished V-neck Cami. The apricot cami featured with spaghetti strap, crochet lace embellished and it can perfectly show your sexy figure. Casual style reveals your unique charm and vitality, adding elegance and style.	Camis & Tank Tops	5
Plus Size Apricot Lace Insert V-neck Sleeveless Jumpsuit. A fashion plus size jumpsuit feature with leopard print, v-neck design, it has two side pockets and invisible zipper on the back. Suitable for work, formal occasions.	BOTTOMS	22
Plus Size Red Tribal Print V-neck Sleeveless Dress. This tribal print dress with v neck design and sleeveless design would make you look in good shape and suit for many occasions such as vacation, cocktail, party. Just pair a sandals is prefect.	DRESSES	20
Plus Size Blue Tribal Print V-neck Sleeveless Dress. This tribal print dress with v neck design and sleeveless design would make you look in good shape and suit for many occasions such as vacation, cocktail, party. Just pair a sandals is prefect.	DRESSES	20
Black Backless Design Floral Print V-neck Cap Sleeves Dress. Floral Backless Slit Hem Maxi Dress. Buy cheap women dresses from reliable online women clothes store to save money! Colorful women dresses come in high quality and available prices! 	Jumpsuit	16
Multi Color Stripe Spaghetti Strap Square Neck Cami. It's comfortable and beautiful with multi stripes pattern, color block design. We love to take it with high waisted Jeans. 	Camis & Tank Tops	5
Coffee Deep V Neck Elastic Waist Tank Top. You seriously do not want to miss out on this tank top, which has elastic waist design that give you curves in the right place. Deep v neck design make syou more sexy. Jus t pair it with jeans is prefect.	Camis & Tank Tops	5
Coffee V-neck Split Design Irregular Hem Tank Top. This coffee color tank top design with v neck and split design. Simple, chic and delightful tee for summer, you can pair it with jeans or leggings. This tank top is breathable and great to wear all day. 	Camis & Tank Tops	5
Army Green Self-tie Design Round Neck Zip Design Playsuit. This short sleeves playsuit features a self-tie design and v-neck design. Styled with your highest heels and biggest hoops, get set to slay in this nude wrap playsuit.	Playsuits	3
Green V-neck Short Sleeves Crop Tees. This simple green tee is v neck design, it would make you look good. Wear it with jeans is suitable for outdoors, homecoming, work.	Tees	4
Stripes Hollow Design Stripe Off The Shoulder Blouse. We are currently obsessing over this blouse. It adorned with stripes and floral print, off shoulder and hollow design. Style it with mini shorts will be perfect. 	Blouses	12
Army Green Self-tie Design One Shoulder Sleeveless Playsuit. New women playsuit here. There are many discounted women clothing at the momen, just come here to find new sprint outfits.	Playsuits	3
Plus Size Black Floral Print Deep V Neck Swimwear. Bring attention to swimwear, which has floral print and deep v neck design. It is the first choice for the beach, you will be more attractive if you wear it on.	SWIMWEAR	2
Plus Size White  Lace Insert Random Floral Print Dress. This white dress with floral print design and crochet lace embellished design would make you look in good shape and suit for many occasions such as vacation, cocktail, party.	DRESSES	20
Plus Size White Lace Cut Out Sleeveless Blouse. Look totally dreamy in this white blouse, with lace-up design, ruffle trim and lace design. Team with tan sandals and jeans for a fanciful look.	TOPS	21
Black Crossed Front Design Off The Shoulder Bodysuit. Add this black bodysuit into your closet. It is designed with off the shoulder and cross front. You can't image how sexy you will when you wear this bodysuit ! If you like, you can also pair it with jeans for casual look.	Bodysuits	7
Plus Size Black Adjustable Shoulder Straps Embroidered Bra. Wide adjustable straps reduce shoulder pressure. The bra is ultra soft and comfortable against your skin, while still providing a shapely fit under your clothes. Skin-friendly and elastic fabric provides extra comfort, comfortable support ideal for C- E cups.	INTIMATES	23
